<?xml version="1.0" encoding="UTF-8"?>
<xs:schema xmlns:xs="http://www.w3.org/2001/XMLSchema" targetNamespace="http://www.hexagon.in/UploadMappingGrammer"
	xmlns:umg="http://www.hexagon.in/UploadMappingGrammer"
	elementFormDefault="unqualified">

	<xs:element name="uploadMappings" type="umg:uploadMappingsForm"/>

	<xs:complexType name="uploadMappingsForm">
		<xs:sequence>
			<xs:element name="mappingDefinition"
				type="umg:mappingDefinitionForm"
				minOccurs="0"
				maxOccurs="unbounded"/>
		</xs:sequence>
	</xs:complexType>

	<xs:complexType name="mappingDefinitionForm">
		<xs:sequence>
			<xs:element name="type" type="xs:string"/>
			<xs:element name="historyTableName"
				type="umg:historyTableNameForm"
				minOccurs="0"
				maxOccurs="1"/>
			<xs:element name="tableName" type="umg:tableNameForm"/>
			<xs:element name="additionalTables" type="xs:string"/>
            <xs:element name="postUploadClass"
                type="umg:postUploadClassForm"
                minOccurs="0"
                maxOccurs="1"/>
            <xs:element name="postUploadEvent"
                type="umg:postUploadEventForm"
                minOccurs="0"
                maxOccurs="1"/>
			<xs:element name="alternateProcess"
				type="umg:postUploadClassForm"
				minOccurs="0"
				maxOccurs="1"/>
			<xs:element name="alternateUploadEvent"
				type="umg:postUploadEventForm"
				minOccurs="0"
				maxOccurs="1"/>
            <xs:element name="roConverter"
                type="umg:roConverterForm"
                minOccurs="0"
                maxOccurs="1"/>
		</xs:sequence>
	</xs:complexType>

	<xs:simpleType name="postUploadClassForm">
		<xs:restriction base="xs:string">
			<xs:pattern value="([a-zA-Z0-9_.])*"/>
			<xs:whiteSpace value="collapse"/>
			<xs:minLength value="1"/>
		</xs:restriction>
	</xs:simpleType>

    <xs:simpleType name="postUploadEventForm">
        <xs:restriction base="xs:string">
            <xs:pattern value="([a-zA-Z0-9_.])*"/>
            <xs:whiteSpace value="collapse"/>
            <xs:minLength value="1"/>
        </xs:restriction>
    </xs:simpleType>

    <xs:simpleType name="roConverterFormForm">
        <xs:restriction base="xs:string">
            <xs:pattern value="([a-zA-Z0-9_.])*"/>
            <xs:whiteSpace value="collapse"/>
            <xs:minLength value="1"/>
        </xs:restriction>
    </xs:simpleType>

	<xs:simpleType name="historyTableNameForm">
		<xs:restriction base="xs:string">
			<xs:pattern value="([a-zA-Z0-9_])*"/>
			<xs:whiteSpace value="collapse"/>
			<xs:minLength value="1"/>
		</xs:restriction>
	</xs:simpleType>

	<xs:simpleType name="tableNameForm">
		<xs:restriction base="xs:string">
			<xs:pattern value="([a-zA-Z0-9_])*"/>
			<xs:whiteSpace value="collapse"/>
			<xs:minLength value="1"/>
		</xs:restriction>
	</xs:simpleType>

</xs:schema>
